ReviewText,Date,Title,UserID,Brand,Product,CelebrityBranded
"NEW! lip-plumping lip gloss …..Got to try a bit at work the other day and the plump feels so nice, almost like an icy hot feeling if I could describe it. The plump feels very nice on my lips… Love it…💕",18 Apr 2024,The plump feels very nice on my lips… Love it…💕,paulalopes,Tilbury,Lip,No
This big lip plumpgasm plumping lip gloss is very nice! The packaging is pretty and the product inside goes on smoothly with the easy to use applicator. The plumping effect is a little tingly and definitely does its job. I would recommend it.,18 Apr 2024,Plumps lips!,Britttnneeyy,Tilbury,Lip,No
"This is the plumper! 

This made my lips burn! I knew it was working! 

Out of all the lip plumpers I’ve used, this one showed results! The color is fab, the formula is great, the texture is buttery smooth! 

I will return for more!",18 Apr 2024,Best lip plumper,Breahanalynn,Tilbury,Lip,No
"I'm a big fan of this lip gloss! To start, the packaging is adorable. It's a little over-the-top and obnoxious, but I think it's so cute and still feels like nice quality. The applicator is great, I love the size and how it tapers at the end so you can be more precise in the outer corners. The gloss itself is a very lightweight consistency and it's easy to get a nice, even application on the lips. The tingling is INTENSE. If you don't like plumping glosses, stay away from this one. I love the tingling sensation and I do feel like my lips look fuller after application. I wish the color lasted a little longer, but it is really sheer and natural-looking. This has definitely become a staple lip gloss in my routine, and I can't wait to try out more colors in the future!",18 Apr 2024,My New Favorite Gloss!,Maddiexx19,Tilbury,Lip,No
"Great packaging, great quality, loved the scent, texture is extremely smooth and non sticky, it’s worth the value for money, highly recommended.",18 Apr 2024,Go for it!!,runs143,Tilbury,Lip,No
"I received this product from Influenster for free in exchange for my honest review. 
I expected this Charlotte Tilbury Pillow Talk Big Lip Plumgasm, Medium Deep, to be amazing. I've tried several lip plumpers, and this is not my favorite.. I like the instant tingle feel, because it feels like it's working.. but after leaving it on, it just barely plumped my lips... I love the color, it's not to bold or dramatic. I also love the glazed finish, like a lip gloss. It doesn't dry my lips out, which is definitely a plus. It's ok, I'll keep using it.. but like I said, it's not my favorite plumper!",18 Apr 2024,It's ok,TinaY091017,Tilbury,Lip,No
This is a great plumper gloss. It does the job but it is very spicy/ tingly and the feeling lasts a very long time after application which im not a fan of. It smells great and the color is beautiful. The packaging is gorgeous!,18 Apr 2024,Beautiful color!,tatty022,Tilbury,Lip,No
"I really loved this color of lip gloss. It is subtle, but yet you can tell there is some color there without being in your face. I’m not sure how well the plumping worked, but there was a good tingling sensation for a couple minutes. I like the applicator that allows for good coverage and when putting the applicator back, it clicks into places so you know it is secure.",18 Apr 2024,Good neutral color,Stef715,Tilbury,Lip,No
Love this plumper. I got in color medium/deep and so beautiful. It’s not that pigmented and it looks beautiful. It tingles a lot and you do get plump effect after putti g it on. Packaging is beautiful. I did not find it sticky,18 Apr 2024,Great product,marimshah,Tilbury,Lip,No
"Pillowtalk Plumpgasm Med Deep is a game-changer for achieving luscious lips. The shade selection is versatile, and the formula glides on effortlessly, providing a plumping effect without the discomfort often associated with lip plumpers. While the color payoff is impressive, I found the intensity to be a bit too much for my preference, especially for daily wear. However, the long-lasting hydration and subtle tingling sensation make it perfect for special occasions or when you want that extra pop of color and volume. Overall, it's a great option for those seeking fuller-looking lips with a touch of glam. I’ll for sure try it in a different color",18 Apr 2024,Great plumper,Karajean623,Tilbury,Lip,No
If you are a brown lip girly this is NOT for you the color blended right in and it just looked like I had on clear lip gloss also could easily get this gloss in a cheaper form for the same type of formula!,17 Apr 2024,Not for brown lip girly’s,mel60805,Tilbury,Lip,No
"This is one now one of my favorite lip glosses. It’s so glossy and smoothing on my lips and the color is so pretty. I love the applicator, it’s so soft and makes it easy to apply. The packaging is so cute too. My lips are already naturally plump however I do feel the plumping sensation for those who want that effect.",17 Apr 2024,So pretty and glossy,Phyliciav,Tilbury,Lip,No
"I honestly don’t understand how this product has five stars.  I absolutely love Charlotte. But this product was an absolute letdown.   It absolutely does not plump.  There is a strong tangle, that did not bother me. But if you are sensitive to a tingle, you’re not gonna like that.",17 Apr 2024,Does NOT plump & the only thing big is the case,MrsZuman,Tilbury,Lip,No
"This colour is gorgeous!!  I'm extremely fair with tiny little lips, so it's really hard for me to find lip products with colour that isn't too much or not quite right.  This made my lips look much smoother almost instantly.  I can't wait to see if their two week claim is true.  I'll keep wearing it regardless!",17 Apr 2024,Perfect colour!,Charmaine75,Tilbury,Lip,No
I received this product for my honest review. The packaging is so nice and I love pink. I think the scent is not too much and I think it is very effective for the price it is listed for purchase. The texture is similar to a product I had before.,17 Apr 2024,My honest review,nenejones2014,Tilbury,Lip,No
I received this product for reviewing purposes from influenster. I actually loved this. It instantly tingles when you apply it. I loved the color as well! It takes about a min or 2 to start plumping your lips but it definitely does. It also leaves your lips hydrated after you take it off. It doesn’t feel sticky and it’s a nice lipgloss to apply. Definitely recommend if you want a lip plumper!,17 Apr 2024,Love this!!,AyaNatsume0309,Tilbury,Lip,No
"I don't really use plumbers, but this one was amazing in my opinion. The color is beautiful and the tingling was subtle and not annoying like some others I have tried. I love the packaging, however the logo? Is a bit weird looking but doesn't take away from the product!",17 Apr 2024,Plump!,JessHaveFun,Tilbury,Lip,No
"Why did she steal Pat McGraths packaging. This is so disappointing, have some originality",17 Apr 2024,Wannabe Pat McGrath,thestylemavenx,Tilbury,Lip,No
"Soooo pretty this is the best lip product I own! The packaging is a 10/10, the texture is like water and thin and cooling 10/10, the amount is comes with is a good amount with .18 fl oz 10/10, color is 10/10 and is universal!",17 Apr 2024,10/10!!!,natattack421,Tilbury,Lip,No
"I’m a sucker for anything Pillow Talk so of course I purchased this. It definitely stings a bit but not in a painful way, and it doesn’t plump the lips some. I love the color of it and that’s really why I bought it. I also bought the new Pillow Talk Fair and I love it even more than the original Pillow Talk. This gloss goes nicely with it.",17 Apr 2024,Great for those who love Pillow Talk,kells77,Tilbury,Lip,No
"An amazinggggg lip plumper! I love how neutral this gloss is also. Normally, I wear pink shaded but sometimes I love a neutral hydrated lip, so this has been fun! I also find that a lot of plumping lip products make my lips super dry  and this one doesn’t do that. It’s a win!",17 Apr 2024,A fabulous moisturizing lip plumper!,bkiser,Tilbury,Lip,No
I love the color of the product but I don’t really use lip plumping products. It was hydrating and nonsticky but I didn’t like the sensation. My lips did look fuller though.,17 Apr 2024,,smarguerite,Tilbury,Lip,No
"I love this product! It smells AMAZING, almost like a sweet light chocolatey smell. It is very smooth, goes on very nicely and has a great applicator tip! It makes my lips feel really smooth and buttery almost, without any stickiness. And I can say that I have noticed a difference in my lips since starting to use it in the past couple of days since I bought it but i also use it religiously!!",17 Apr 2024,A must have!!!!!!,Ktumanov1988,Tilbury,Lip,No
"So to be expected, it tingles a lot! As soon as it touches your lips it starts to tingle and the sensation doesn’t seem to go away. It doesn’t look like my lips look plumper. It has the “feeling” of it but I don’t see much of a change.",17 Apr 2024,Didn’t like it,VickyArmas,Tilbury,Lip,No
"I’ve used lip plumpers before.  They’ve always hurt my lips. They burn really bad, and seem to leave them chapped after use. This one has a very light cake like smell. The color looks really dark in the tube, but nice light and glossy on the lips. I feel like this pumped up my lips a little bit. My top lip looks more full than normal. Would I possibly purchased it in future yes! It’s quite moisturizing, and the tingle factor is not terrible at all! so this is a definite try for anyone!",17 Apr 2024,I really like this one. It’s awesome.,crasberry,Tilbury,Lip,No
"The packaging is beautiful.  Very detailed.  When you put the lipgloss on it has an intense burning sensation.

Has a vanilla scent.  Initially, it applies with a cooling feeling but transitions to a burning sensation.

The result is a very glossy lip and a fuller, plumper illusion. Overall, the burning effect is very intense and lasts for a long time",17 Apr 2024,Big time lips,paisleypallas,Tilbury,Lip,No
"Beautiful packaging. Beautiful lip gloss! Compliments of Influenster, this Charlotte Tilbury lip gloss goes on smooth with no glitter particles. The color is so pretty. The added bonus is the lip plumping sensation. It’s not too intense but just right.",17 Apr 2024,Beautiful Lip Gloss,thecreativelady,Tilbury,Lip,No
Love this lip plump gloss. It’s not sticky or too tingling like other plumping products. The color is beautiful. Price is right.,17 Apr 2024,Beautiful color,HavocsGirl,Tilbury,Lip,No
I really loved this lip plumper. It went super smooth. It’s light. It’s not sticky. It’s a beautiful color. It’s also not too overpowering where you can’t feel your lips.,17 Apr 2024,Beautiful color,Stacerela77,Tilbury,Lip,No
"I received the Charlotte Tilbury Pillow Talk Big Lip Plumpgasm Plumping Lip Gloss complimentary in exchange for my honest review. This is my new favorite lip plumper. First, the packaging is gorgeous like all of Charlotte Tilbury’s products. It has a perfect applicator for sapling it to thin lips like mine. The shade is gorgeous. This gives you a tingle to your lips like most lip plumpers but it is not painful at all. I am skeptical with most lip plungers and don’t usually see any difference but this is one of the few that I do notice my lips look more plump.",16 Apr 2024,My new favorite lip plumper!,,Tilbury,Lip,No
"i’ve been using this plumping lipgloss none stop! it does wonders and the color is so beautiful, matches any kind of makeup",16 Apr 2024,i love it,farryy,Tilbury,Lip,No
"I love this product, but I hate the packaging. It gets really messy at the top, and you end up wasting a lot of the product when you have to clean it up.",16 Apr 2024,"Great product, bad packaging",nordygirl68,Tilbury,Lip,No
"Ladles come closer and listen to me, okay. Seriously, this stuff is like magic in a tube. It's like my lips' BFF, giving them that perfect pouty look while keeping them moisturized all day long, my darlings. Not only does it make my lips look fuller and more luscious, but it also feels amazing with that tingling sensation. And the scent? So dreamy! Honestly, I can't get enough of this stuff. If you're on the fence, just go for it—you won't regret it! This one I highly recommend for eveyr lip out in these streets. 5 ⭐️⭐️⭐️⭐️⭐️💋",16 Apr 2024,Obsessed with Charlotte Tilbury's Pillow Talk Big,007aeRaL,Tilbury,Lip,No
I love this! The color is perfect. It isn’t sticky. The plumping sensation is not overwhelming but I do feel the tingling. I am excited to purchase this is multiple colors!,16 Apr 2024,One of my favorite plumping lip glosses!,Brittany22207,Tilbury,Lip,No
"I love the packaging of this gloss and I love the color , it leaves a little sting at first but nothing unbearable . It gives a fuller lip and it is glossy , for me perfect after filler . I do have to reapply throughout the day but other than that there’s no flaws . I love how glossy it is .",16 Apr 2024,Glossy,heaven007,Tilbury,Lip,No
This is such a pretty shade and it is super glossy however I did not notice any plumping. The sensation felt more like a burning feeling than a tingling one. I tried to trust the process but it got too painful.,16 Apr 2024,,lktran1,Tilbury,Lip,No
I absolutely love this color its a nice light nude color gloss. It’s is visibly noticeable for the color and the plumping! It only lasts 15 minutes or so and leaves your lips super hydrated and moisturized. Definitely a new favorite. I can’t wait for them to come out with more colors!,16 Apr 2024,A new fav,Hannnnah12,Tilbury,Lip,No
Obsessed. The name is adorable. The packing is so chic. It's SUPER tingly so I known it's putting in work. Not to mention the shade is the PERFECT neutral.,16 Apr 2024,Perfect neutral with a boost,CourtneyHart,Tilbury,Lip,No
"this lip gloss is the bomb.com! It has a beautiful sheen, and is very plumping but not uncomfortably so. Leaves a super pretty glossy color. Even though I’m a fairer skin tone, I got the deep shade and I absolutely love it! It’s the perfect deep nude, and not too dark. Packaging is an absolutely beautiful with a perfect doe-foot applicator that delivers just the right amount of product. this feels luxurious and high-end definitely up to this brand standards.  I love Charlotte Tilbury!",16 Apr 2024,Love it so much!,SultanSarah,Tilbury,Lip,No
"I love both of these colors and the fact that the medium one is a my lips but better shade. What I liked about this gloss is that the formula is very creamy. It applies very opaque and can be blotted to a more sheer coverage. The plumping formula did minimize the lines on my lips. I did find the applicator was really big and picked up a lot of product so I had to wipe it on the inside of the container. This did not last as long as other formulas I have tried. I think it wears a little less time because it is very pigment saturated and creamy. I find I do need a mirror to apply it though because of the applicator size. I typically don’t use a mirror whenever I apply loss, so I’ll probably just apply this one time a day.",16 Apr 2024,"Great color, large applicator",addictedtogloss,Tilbury,Lip,No
"Color is great, but the burn from the plumping effect is intolerable. It burns and hurts, and even more so if any tiny bit gets in your mouth. I wanted to love this, but couldn’t handle the pain.",16 Apr 2024,Ouch!!!,Shell0505,Tilbury,Lip,No
"This is without a doubt the most plumping lip product I have ever tried. The color is sheer enough to blend with your natural lip color and create the prettiest hue, and the gloss is absolutely stunning. The plumping effect is intense, but that’s to be expected. My lips definitely look bigger with this on them and I’m a HUGE fan!",16 Apr 2024,The most PLUMP my lips have ever looked!,kcalabrese2414,Tilbury,Lip,No
"Just the packaging alone is stunning, it is quite sizable and she’s not tiny; but we love her. The colors could both fit easily any skin-tone, but as brown gurl: definitely the medium-deep. Nice formula",16 Apr 2024,"It’s giving luxury, CT for the win!",LoreLaMe,Tilbury,Lip,No
I have been using this plumping gloss for a few weeks now and I really like it! It is hydrating (a bit sticky) and goes on smoothly. I LOVE the color. You can feel the tingle of the plumping effect right away but it doesn’t burn like other plumping glosses. **Warning-the tube itself is a bit suggestive,16 Apr 2024,Pretty and Plumping,MrsBerry21,Tilbury,Lip,No
"I think its a 7/10! I love the texture- its not sticky or too thick. It smells amazing and it’s really nice on the lips. The plumping effect didn’t do much for me (couldn’t really see it) compared to my other plumping glosses- but you definitely feel it more. Aside from this I like how glossy it is- AND THE PACKAGING 🤌🏼

I got the shade Fair-Medium. Its the perfect pink for me!",16 Apr 2024,Its really good!,NicolaRosario,Tilbury,Lip,No
The best gloss! This stuff lasts for hours and makes my lips look visibly plumper. It doesn’t have a strong smell and it leaves my lips feeling soft and moisturized.,15 Apr 2024,Love this stuff!,Laurenms22,Tilbury,Lip,No
Wow this has some serious plumping power! You can feel it working and it’s very apparent it plumps my lips! I love the packaging it’s adorable! My new favorite lip gloss,15 Apr 2024,Love,hwoosl,Tilbury,Lip,No
"The color is beautiful, this beautiful rose brown, but it is super plumping! It will tingle for about 15 minutes and it's pretty potent. I personally would have liked it better without the plumping but it's a beautiful color.",15 Apr 2024,very plumping,ReginaBach,Tilbury,Lip,No
"I received this lip plumper from Influencer in exchange for a review. 

Pillow talk big plumping lip gloss lives up to its name. I tried the Charlotte Tilbury color and lived the natural shade it provided. As soon as you apply you can feel this lip gloss go to work with a slight tingle that provides a fuller lip look your looking for. The container is super cute making this lip gloss and all around win.",15 Apr 2024,Plumping Plumper,Katcle,Tilbury,Lip,No
"I love it! Works perfectly and the color is perfect for my skin tone, I love it, I highly recommend this product",15 Apr 2024,Lip plumper,garciaisabella,Tilbury,Lip,No
"This lip gloss is thick but not sticky. It’s a nice nude color that goes on with a sheer tint of color. Because it is a pumping gloss, it does tingle for about 30 minutes after applying. I’m not sure if it made my lips that much juicier, but I’d like to think so (it feels like it anyway). Either way, whether or not it makes my lips appear more plump, I’m not a fan of lip gloss, but I do like this one. Note, it has a 12 month shelf life after opening so use it or loose it. I rate this lip gloss 4 out of 5 stars. Note, while Charlotte Tilbury is cruelty free, it is owned by a parent company that tests on animals. The parent company is Puig, and this is not a cruelty-free company. If this matters to you.",15 Apr 2024,I like it!,lalena84,Tilbury,Lip,No
"The color and shine on this are gorgeous, and it's not super sticky, so it's a shame that this isn't a plain gloss. The plumper in it hurts so bad! I've never found a plumper that doesn't hurt, though, so maybe I just have sensitive lips? It feels cool like menthol at first and then after about a minute it turns into straight up stinging pain. I wiped it off, but in the five minutes I managed to tolerate it I did not notice any plumping effects.",15 Apr 2024,Stings horribly,allie3096,Tilbury,Lip,No
The packaging is so cute and very durable feeling. There is really no scent to it so if you don’t like scented lip products you will love this. The texture is is very thick but creamy. You definitely can feel this sensation of the lip plumping. And I love the color,15 Apr 2024,Love,Saminsider09,Tilbury,Lip,No
"Y’all! The packaging is so adorable! I just can’t! I am pink obsessed, so this is totally me! I love the formula of this lip plumper! It’s super velvety & creamy. It glides on smooth, and evenly. I’d say the plumping aspect of it is rather nice. 

It’s the perfect ratio of tingle/burn/cooling. A little of each. It’s subtle, and not super overpowering like some or the majority of lip plumpers can be. I’ve actually never really tried a lip plumper that is capable of doing all three until this one! 

This is the shade “Pillow Talk”, and it’s a medium deep color. Very pretty, and looks good on lighter skin tones, such as myself. I feel like it goes on kinda dark, then lightens up a bit once it covers over a larger portion of your lips. 

If you want to deepen the color, you totally can. Just apply another layer, until you’ve achieved your desired look! It’s super hydrating and ultra moisturizing, you simply cannot go wrong with this one! 

I absolutely love it! My absolutely go-to, as of lately! Thank you Charlotte Tilbury, for yet another amazing product I can totally obsess over! 10/10!",15 Apr 2024,Obsessed!,beauty0717,Tilbury,Lip,No
"The product's texture is pleasingly smooth, Nude in color and that is a bonus since I Don't ware makeup, retains a lustrous sheen, and induces a stimulating sensation upon application. It possesses a subtle minty aroma that is not overpowering.",15 Apr 2024,I like it,TySha86,Tilbury,Lip,No
"I LOVE this product! I have thinner lips so I love when a lip product can give me a boost. This gloss gives my lips a natural plumpness with a hint of color, and even when the glossiness wears off my lips stay soft and lightly tinted.",15 Apr 2024,,Lilli547,Tilbury,Lip,No
"I received this Pillow Talk Lip Gloss compliments of Charlotte Tilbury and Influenster for my review. For starters I love the tube, it's really pretty but if you're looking for pouty plump lips this PLUMPGASM Lip Gloss does the trick. You'll immediately feel the plumping sensation upon application. A must have in your cosmetic bag. 💋 💄",15 Apr 2024,A must have in your cosmetic bag. 💋 💄,MakeMeUp247,Tilbury,Lip,No
"I was excited to try out Pillow Talks Big Lip Plumper, but was a little disappointed in the plumping factor. The color was perfect and exactly the shade I prefer, it had a scent like a seasonal vanilla candle, but just didn’t do much for plumping. I was able to try this out for free on exchange for my review!",15 Apr 2024,Love the color,drimeth,Tilbury,Lip,No
I received this product for free in exchange for my honest review. I love love love this new lip plumping gloss. The color is perfect & the shade I would normally pick out & it truly makes my lips look kissable. I have been using the NYX duck plump & I would say this one is right there with it,15 Apr 2024,Amazing!,Nicoletterich,Tilbury,Lip,No
"Get ready to pout with perfection! Charlotte Tilbury's Pillow Talk Big Plumpgasm gloss in the shade medium-deep is an absolute game-changer. Not only does it give you that irresistible tingling sensation for a plumping effect, but it also transforms your lips into a mesmerizing glass-like finish. With just one swipe, my lips feel luscious and look oh-so-plump! It's like magic in a tube – I'm obsessed!",15 Apr 2024,Perfection!,TheRavePharaohe,Tilbury,Lip,No
"Love this plumper! Can we talk about the color?! Omg! The shade is beautiful. The shine is amazing. The flavor is vanilla. The scent is delicious. The cooling sensation is a bit intense. If you're familiar with plumping glosses, you already know how it is IYKYK!
I would like to try this in a few other colors because it's one of the best and most effective lip plumping glosses I've tried.",15 Apr 2024,,Bwitched413,Tilbury,Lip,No
I love that. I got this for free from influencer got to try it before actually buying it And I will recommend and I will buy it,15 Apr 2024,Lip plumbing,DarlinLove,Tilbury,Lip,No
This Pillow Talk plumbing lip gloss by Charlotte Tilbury is so pretty on the lips. It has just a little tone that adds some color and glossiness to your lips. After applying it does have a slight tingling sensation but it's very minimal. The plumping affects works after just a minute or so and makes you have fuller looking lips. It helped my lips feel more hydrated and pretty. I would definitely get it again and recommend it to friends and family. I received a complimentary item for testing purposes.,15 Apr 2024,Glossy and Plumping,cdhacker,Tilbury,Lip,No
LOVE this product. Love the pillow talk shade and I love that it’s also a lip gloss plumper now!,15 Apr 2024,Love this product!,bgatlin,Tilbury,Lip,No
The idea behind this product is what i loved the most. As you put this on your lips it gives mild tingling sensation and in few seconds you quite literally observe your lips getting plumped up. Oh and i love this shade from charlotte tilbury. It matches brown skin so well. Packaging is ok for me but the product is wow.!,15 Apr 2024,Nice product.!,vaelyn,Tilbury,Lip,No
Such a good lip plumper (and I’ve tried them all)! Tingles a little but nothing crazy! I just wish there were more shades!,15 Apr 2024,Love this plumper! It actually works!,megs12,Tilbury,Lip,No
I love the packaging of this lip gloss. It’s so cool looking. Lip gloss itself has a nice coral color. It’s very lightweight and it’s not much sticky at all even though it gives a nice glowy look.,15 Apr 2024,,khamoshi52,Tilbury,Lip,No
This product has a cooling effect that lasts 20 minutes top. This does not feel like it’s plumping my lips. I usually am a lip oil girly and I like thicker consistencies because they last longer for me. This was a very thin consistency and I will be returning this.,15 Apr 2024,Nice color. Not lasting. Not plumping.,CocoChan3lle,Tilbury,Lip,No
I apply this and instantly feel a boost. It’s a very flattering gloss that lasts for hours. I really like this pigment and would love to try others. I recommend!,14 Apr 2024,Burns so good,EmBrix155,Tilbury,Lip,No
