ReviewText,Date,Title,UserID,Brand,Product,CelebrityBranded
"I received this product for free from @Influenster and @charlottetilbury in exchange for my honest review. The first photo is the before the second one is the after. 

I am always skeptical about using a of lip plumper due to the terrible burning feeling, but this lip plumper gives an icy hot feeling. It applies so smoothly and is not sticky in the slightest. The plumping happens almost immediately and lasts me about 45 minutes. I got the medium-deep and I’m obsessed with the color it gives. I will definitely be getting another lip gloss after this once runs out. Definitely recommend.  Oh! And the lip gloss tube is super cute!",4 Apr 2024,A must have non-sticky lip plumper,mikdock,Tilbury,Lip,No
"It’s such a beautiful color for medium to deep skin tones. It plumps the lips and made them
Look flawless. I love the formula doesn’t feel sticky",4 Apr 2024,It’s a pretty color,sehaari,Tilbury,Lip,No
All charlette Tilbury products have that glam look that makes you feel so good to own.I absolutely love the way my lipgloss looks like with combination of pink and glittering gold.The product itself is really impressive with thick smooth gel and highly pigmented color.It does have a little sting to it as you just apply it but it goes away.,4 Apr 2024,Loved the shade,leeb2,Tilbury,Lip,No
"The tingling is not necessary, it does nothing and hurt for no reason. It’s such a pretty colour and I like how it looks however the sting is not it. So I took off 2 stars for it. I will trying to find the shade in another version.",4 Apr 2024,Nice but it stings,chennerz,Tilbury,Lip,No
"I received this product for free from Influenster and Charlotte Tilbury in exchange for an honest review. 
I love the medium-deep color of the gloss as I do prefer a darker tint. I feel like the color was a nice complement to my skin tone. The glossy part was nice and smooth and not at all sticky feeling. The applicator allowed it go apply really smoothly and evenly. 
In regard to the the plumping…. I have used it for a few days and honestly don’t notice a visual difference today or any other day prior. I do get the lip sensation of the “tingle” that comes with a plumper however. The feeling is a fresh feeling, like after you brush your teeth or use a minty mouthwash. If it is still on when I eat, or I lick my lips my tongue  feels strange and offers an odd taste to my food. I do love the color though.",4 Apr 2024,Such a beautiful color,RealQueenAndi,Tilbury,Lip,No
"I got the fair-medium shade of this lip gloss and I love it! It isn’t too light or too dark. It definitely feels like you put icy hot on your lips, and you can feel the plumper working right away. I did notice a visible difference in my lips. It did plump them up a bit. I liked the cool feeling of the lip gloss and the shade! My only downside of lip gloss is that it rubs off, onto straws, cups, my teeth, etc. so it doesn’t last very long on my lips. Other than that it is great!",4 Apr 2024,Great!,casey090,Tilbury,Lip,No
"Charlotte Tilbury Pillow Talk Medium Deep is my new go-to! The shade is perfect for my skin tone, giving me that natural, radiant look I love. The formula is so smooth and blends like a dream. It's become a staple in my makeup routine, and I can't recommend it enough!",4 Apr 2024,Pillowy Smooth,BrandiBell,Tilbury,Lip,No
"The packaging is absolutely perfect. Super cute and fun. There was a sweet vanilla scent to it, and I like that. The texture was like a normal, thicker gloss. It did plump my lips, but I really did find it comfortable. Received free in exchange for honest review.",4 Apr 2024,Just 👍,LadyBugLush,Tilbury,Lip,No
This gloss immediately gives you a tingling sensation and plumps up lips with a shiny gloss. I love the marshmallowy scent and the packaging is so cute. I think it’s worth the price.,4 Apr 2024,Plump and shiny,irizmae,Tilbury,Lip,No
"I really hate lipgloss but THIS GLOSS??? I LOVE IT SO MUCH such a beautiful beautiful formula and such a perfect brown nude for desi brown skin. Im so so grateful to have received this from Influenster. Its definitely been added to my everyday makeup routine, whether its as my lip of the day or as my pre lipstick treatment, it helps my lip creases be less visible and it helps soften my lips up for lipstick application",4 Apr 2024,Desi Brown Girl Approved!,akhda,Tilbury,Lip,No
So beautiful lip gloss. It stays long day and make my lip looks bigger. The package is so beautiful. The texture is soft and moisture. It smells so good...,4 Apr 2024,Love it,isatran512,Tilbury,Lip,No
Love it. Loved everything about it. Pillow Talk is one of the most widely known colors that is perfect for every person and skin tone. The packaging is so pretty and big to match this Big Lip Plumpgasm. I put it on and the color was perfect. After a few minutes you can feel the tingle start to work. It definitely helps make your lips look fuller and shinier. I'm so happy with this and will keep this as a staple in my lip kit.,4 Apr 2024,Perfect for everyone,Browneyed115,Tilbury,Lip,No
"Ummmm the packaging of this..so sleek and and cute. The applicator makes this so easy to apply and unlike other glosses this doesn’t feel heavy on the lips, very thin in texture. The plumping effect isn’t very overwhelming plus the shade match is so good so I would actually use this item frequently!",4 Apr 2024,A new add to the gloss family!!,Insideer16,Tilbury,Lip,No
Charlotte Tilbury Pillow Talk Lip Plumpgasm Plumping Lip Gloss is great. The shade Fair-Med compliments my skin very well. You can feel the tingling sensation just as I applied it to my lips. It leaves a glossy finish and has my lips looking plump.,4 Apr 2024,Great lip lump,shantelcox13,Tilbury,Lip,No
"I absolutely love everything about this gloss!! It’s like a nude pink color…not overpowering at all. You can feel the almost cinnamon burning sensation on your lips as it’s plumping up your lips. I do think this plumps my lips a bit and my Husband agrees. This lasts, it didn’t wear off as quickly as some similar things I have used. It also has a sweet vanilla smell that is divine!",4 Apr 2024,Absolutely love love this,PlAnTlAdY83,Tilbury,Lip,No
I like the tube and applicator. The packaging is also super cute. The consistency is good- not too thick and I like the color. Looks darker out of the bottle than when applied on my lips. I’m giving 3 stars because this feels like a thousand hot needles piercing/stinging my lips when I apply. It’s almost scary cos I’m not sure if I should be worried. I’ve applied twice to give a thorough review and to verify the effect it’s had but I’m very cautious to apply anymore. The stinging continues for 20-30 minutes then it starts to reduce after about 35 minutes. My lips do appear soft and plump for 5 hrs at least. I just don’t know if I like the feeling or that it’s worth it.,4 Apr 2024,Burns lips,Mscreamie,Tilbury,Lip,No
Not a huge fan of this product it’s very tingly on my lips and I am not a huge fan of this. However the color is very pretty,4 Apr 2024,Very tingly,jesslililila,Tilbury,Lip,No
"The Charlotte Tilbury Lip Plumper gloss in the shade 'pillow talk' has quickly become a staple in my makeup collection. I have tried many lip plumpers in the past that have done nothing, but I have to say, Charlotte Tilbury knocked this one out the park! 

First off, upon opening, it is a beautiful & uniquely made, high-quality packaging, with a cute lips logo on there. The application is also perfect, providing just the right amount of product without being too messy.  The gloss has a smooth and creamy texture that glides on effortlessly, making it perfect for everyday wear. The color is a gorgeous muted rosy nude that complements my skin tone perfectly. I immediately felt a tingling sensation on my lips. It wasn’t uncomfortable, but rather a subtle plumping sensation. I could see a noticeable difference in the fullness of my lips within minutes. 

What I love most about this lip plumping gloss is that it not only enhances my natural lip shape, but it also adds a hint of fullness and volume. It's like a non-invasive lip filler in a tube! One of the main ingredients in this gloss is hyaluronic acid, which is known for its hydrating and plumping properties. I have also noticed that my lips feel more moisturized and smoother after using this product. I have received many compliments on my lips since using this gloss.

The best part is that it doesn't dry out my lips like some other plumping products do. Instead, it leaves them feeling hydrated and nourished thanks to the nourishing ingredients such as coconut oil and shea butter. 

Additionally, I also appreciate that it is cruelty-free and made with natural ingredients, which is a huge plus for me. 

The only downside to this product is that it is a bit on the pricier side, but I believe it is worth the investment. A little goes a long way and the results make it worth the price.

In conclusion, I highly recommend this lip plumping gloss to anyone looking for fuller and more hydrated lips.",4 Apr 2024,A must-have,Beautyjunkie199,Tilbury,Lip,No
"My favorite thing about the Charlotte Tilbury lipgloss is definitely the tube it is beautiful then when you open the package you get the most luxurious chocolate smell, which makes you definitely want to try the gloss. Once I applied the gloss I did feel a tingly sensation as you do with all pumping glasses, I felt that the texture of it was reminiscent of a lip oil, and it had just the right amount of pigmentation for a nude look, not super opaque. The gloss level of it is super super shiny and reminds me of patent leather.",4 Apr 2024,Not sticky,Glitz25,Tilbury,Lip,No
"￼I love this plumper!! The color is perfect for me too! I’m a natural nude kind of girl and I adore this product! I have never owned Charlotte Tilbury lip products, but this is an wheat the product to me! The packaging is absolutely beautiful and the way my lips look and feel is amazing! I personally love the tingle of all lip plumper and I didn’t need a lot of product to cover my lips so that means I’m really gonna get out of!",4 Apr 2024,Best plumper out there!!,Honduranchica,Tilbury,Lip,No
This charlotte tilbury big lip plum gasm is hydrating and plumps your lips at the same time. The color is so beautiful. If you love their pillow talk lipstick then you will love this shade too.,4 Apr 2024,Love this,T0mad3y,Tilbury,Lip,No
Such a pretty shade. You can definitely feel the plump in progress as soon as you put it on! The formals isn’t super sticky either which i really like.,4 Apr 2024,So pretty,KaylaAckerman,Tilbury,Lip,No
"Another iconic launch from Charlotte Tilbury! The packaging design is delightful and the applicator wand is perfect. I particularly enjoyed the addition of hyaluronic acid, which helps smooth fine lines for extra plumping.",4 Apr 2024,Perfect pout,sakurasunset,Tilbury,Lip,No
"Lip gloss like this is 10000/10. Although it's not sticky, it's thick enough to hold without requiring frequent reapplication. The term comes from how lovely and glassy the clarity looks color is amazing and perfect. It smells lightly and not overpoweringly. Unquestionably a fantastic addition to my stash of lip gloss. The size and shape of the applicator was also excellent!",4 Apr 2024,Must have !!!,Esraa96,Tilbury,Lip,No
This gloss is definitely plumping! You can feel it as soon as it goes on. It’s a smooth gloss but has a rich color to it! The scent is a little sweet. The packaging is pretty and secure.,4 Apr 2024,Love this plumper!,VioletaCAlvarez,Tilbury,Lip,No
This lip gloss design is everything it is so freaking cute!! I love the color and it really plumps your lips up I love it I definitely would recommend,4 Apr 2024,Must try!!,MsBrittC,Tilbury,Lip,No
I love its thick and soft texture with your lips it has a little color and makes them look bigger and very beautiful when applying dolo you feel a little freshness but it is acting to lift your lips it is perfect and effective it lasts a lot on your lips its essence is sweet its design is very elegant perfect to carry in your bag,4 Apr 2024,Love it,Greys30,Tilbury,Lip,No
This lip gloss is awesome. It tingles your lips to make them plumper and goes on so smooth. Making your lips look delicious and so soft. The color is gorgeous and shiny.,4 Apr 2024,I'm in love with this gloss,xtremist4life,Tilbury,Lip,No
"The color of this lip gloss is very pretty. However, like other lip plumping products, it leaves your lips with a burning/tingling sensation.",4 Apr 2024,,jessicab23,Tilbury,Lip,No
The package is beautiful! You can definitely feel it once you put it on it’s gets hot and icy feeling. Did a good job at plumbing up my lips. Hubby does not like to kiss me when I have this on tho lol I hit this free to try by influencer  in exchange for my honest review,4 Apr 2024,A must have,Oceaneyes1982,Tilbury,Lip,No
This is fantastic I love the way it looks on my lips I am crazy about it and the plumping is cute as heck it’s tingly but kinda minty I love it stays in my purse everywhere I go,4 Apr 2024,A must have,peachhx,Tilbury,Lip,No
Wow zaaaa. Talk about lip plumper. Definitely a very strong lip plumper. Lots of super hot tingling action going on with this plumper. Nice color and look.,4 Apr 2024,Wowwwe,katrnone,Tilbury,Lip,No
"As someone who loves a natural yet glamorous look, I was thrilled at the chance to try the Pillow Talk by Charlotte Tilbury Lip Gloss! First impression….
💋True magic for anyone looking to enhance their lips without a needle! The fair-medium shade complements various skin tones + provides subtle pop of color that's perfect for everyday without looking too overdone.
💋plumping effect = noticeable but not overpowering, giving my lips a fuller appearance w/o discomfort. 
💋Plus, formula = enriched with nourishing ingredients (hyaluronic acid, peptides, etc.) leaving my lips feeling hydrated and smooth. WIN-WIN-WIN!!!

🫦Only downside is it may require reapplication throughout day to maintain plumping effect. However, the smooth packaging makes it easy to touch up on the go.

💋VV impressed with the results. Pricy but hope to make this a staple in my makeup routine, as it’s exactly what I’ve always aimed for - adding a touch of sophistication + confidence to my look without the clown effect in just a few swipes! 🪄",4 Apr 2024,CTPlumpGasm,amanda00o0,Tilbury,Lip,No
I think the packaging is super cute. The scent is amazing. It smells like vanilla. It works super fast as soon as I put it on my lips I could feel it working. ￼,4 Apr 2024,🤩🤩,nicki0924,Tilbury,Lip,No
Great color! I love the packaging which is very heavy. The smell is very very sweet and cakey. I think it’ll have good staying power overall which is nice,4 Apr 2024,,alycat1012,Tilbury,Lip,No
I tried this Charlotte Tilbury lip plumper and did not like it. It was a very uncomfortable sensation that actuallu felt like fire on my face. It's a no for me. I did receive this product free in exchange for my honest review from Influenster.,4 Apr 2024,Nope!,MamaKula,Tilbury,Lip,No
"Pretty good for a lip plumper! Shine lasts and there is a fuller noticeable difference. The gloss is spicy, burns a lil more than lip injector gloss and fenty heat but the after effect is awesome",4 Apr 2024,Cheaper than filler!,lizard801,Tilbury,Lip,No
"I always thought that this brand is just blown up, hyped up but from the experience I can safely say that it isn’t the truth. The lipgloss was made with “plumpgasm” heat and ice technology with added hyaluronic acid and collageneer. It will plump up the lips with long lasting hydration and it will add a 3D optical illusion to the lips. Easy to use, just glide over lips with the wand. I really enjoy the scent, it reminds me of the chocolate. And the heating effect is absolutely amazing and I love how it feels.",4 Apr 2024,I love this,Maryserbia,Tilbury,Lip,No
"I’ve never quite found a lip plumper that worked well without burning or making my lips sting. This lip plumper is an exception!  It feels nice and cooling on and dang does it make your lips look smooth and plump. It’s honestly the best lip plumper I’ve ever used. The packaging is also hefty and gorgeous. The only thing I didn’t love is once it’s been on for a while it leaves a light tackiness like a stain, but I don’t care because it makes my lips look like I got filler! Thanks to Influenster for sending me this free for my honest review!",4 Apr 2024,Holy crap amazing,lomichelle91,Tilbury,Lip,No
"Beautiful gloss in a beautiful package. This delivers a shine that works well with any makeup look. I can’t say I really noticed a plumping effect but I did feel the capsaicin causing a tingling effect when applied which I thought was stronger than other plumping glosses I’ve tried. Great if you’re looking for a pillow talk gloss, I’d look elsewhere if you want more plumping.",4 Apr 2024,Great gloss and shine!,darksalamander,Tilbury,Lip,No
Very cute packaging. It is easy to apply and comes in a really nice shade. It seems to work well and the feel of the tingle is preferable to other products.,4 Apr 2024,Cute packaging and not too harsh,angieundead,Tilbury,Lip,No
"I am not a huge fan of lip plumper products as they don’t typically seem to work, but WOW! I have been loving the Pillow Talk Plumpgasm since I received it from Influenster! The packaging is adorable and the product is a beautiful color and texture. Highly recommend adding this to your collection of lip products!",4 Apr 2024,My new favorite lip product!,lexxg10,Tilbury,Lip,No
The packaging is beautiful. The lip plumper is gorgeous. I love everything about this product. Love the way my lips look. Doesn't burn or anything. I would definitely repurchase this product and I highly recommend it!!,4 Apr 2024,My new favorite!!,Vanahbaby,Tilbury,Lip,No
"I received Charlotte Tilbury Pillow Talk Big Lip Plumpgasm Plumping Lip Gloss complimentary for my honest review.

I am a big fan of Charlotte Tilbury cosmetics so jumped at the chance to be able to try her Pillow Talk Big Lip Plumpgasm Plumping Lip gloss. The lip gloss comes in the cutest packaging with little gold lips on the container. It looks very luxurious. The pillow talk color Med-Deep is a very neutral muted brownish/berry color that looks darker in the tube than on. It is very sheer and super glossy and looks great alone or over a lip liner or lipstick.  I think it would work great with many different skin tones given how neutral it is.  The lipgloss tingles when you apply and the plumping effect was long lasting.  Overall, this is a great, high-shine gloss!",4 Apr 2024,Super Shiny Plumped Lips,sflm,Tilbury,Lip,No
This feels so juicy ! And hydrating on the lips. It’s legit the perfect color it matches my natural lip color perfectly! It has a really nice shine and goes on really well! No burning but you feel a coolness,4 Apr 2024,Love the icy effect,theashmarie,Tilbury,Lip,No
"This lip plumper smells absolutely amazing. It gives off a marshmallow sent and it does shine and tint my lips perfectly. However, I didn’t see a difference with the plumping. It does make my lips tingle a little but not how I would’ve thought.",4 Apr 2024,So pretty,DearTayy,Tilbury,Lip,No
I love the color of this and it does leave my lips nice and smooth all day. I didn’t really notice any plumping though.,4 Apr 2024,,ladyj0717,Tilbury,Lip,No
Easy to apply and smells really good. Doesn’t burn that much but it does have a slight burning sensation. I love the color as well goes well with my complexion. The packaging is really cute.,4 Apr 2024,,Curly92,Tilbury,Lip,No
I love love these plumping lip gloss! It’s so beautiful and so effective! The color medium/deep super nice!!! Definitely worth the try!! Will be purchasing in the future fo sure!!!! Love it!,4 Apr 2024,Must have!,ujinb,Tilbury,Lip,No
i love thai product it’s so pretty and has everything a girl that ants,4 Apr 2024,love it,Argavana,Tilbury,Lip,No
"I received this magnificent Liostick like a gift from Influenster & Sephora and I must say that in my first test I saw the results, the lipstick is for the effect of full lips, leaving an itchy sensation for said effect. It has a large applicator that makes it easier to use. The size is super good, it seems small but it is actually wide. For this review I give it 10/10 because I was fascinated and I recommend it 100% Thank you very much!!",4 Apr 2024,Bid lips plumpgasm 💋,Lantmart23,Tilbury,Lip,No
The packaging is adorable. The doe applicator is really soft. This gloss is quite pigmented so a little goes a long way! The color is gorgeous and not crazy dark. No sticky finish and makes my lips soft. There’s a cool sensation that makes it zing when you breathe in and out.,4 Apr 2024,Gorgeous color,ericacax3,Tilbury,Lip,No
"I really like this! The plumping effect has a slight tingle, but not burning like most. The color is lovely and the texture is soft and slick without being sticky! I also like that it’s not a bold color, it’s a MLBB shade. The tube is large, the “quilted” stamping on the top is cute. The Dow foot is perfect and it has a mild to medium plumping effect",4 Apr 2024,Solid performer!,TW1028,Tilbury,Lip,No
I received Charlotte Tilbury Pillow Talk  Big Lip Plump Gasm in the shade Medium-Deep free for review from Influenster and Charlotte Tilbury. I love the packaging and applicator. The color is good on me. The ice then fire plumber is okay I didn't notice much of a difference. I recommend for the color alone.,4 Apr 2024,Beautiful,Bug96,Tilbury,Lip,No
I received this product free from Influenster and Pillow Talk in return for my honest review. The color is subtle and natural plus glossy. The plumping effect happened very quickly. My lips are naturally full but this product gave them a plumper look.,4 Apr 2024,Amazing 😍😍,bleuchik,Tilbury,Lip,No
I love this plumping lip gloss! The packaging is absolutely beautiful and the shade is gorgeous! It has a vanilla scent and it’s not sticky at all. It’s very smooth and there is tingle but not to where it’s painful. I love it!,4 Apr 2024,,rosie22,Tilbury,Lip,No
I’d like to start by saying the packaging is super cute. Makes you feel like you purchased something special. Now the feel of this lipgloss is great it’s not over stingy or burning. It’s super shiny and smooth not sticky. The color I received is not really my favorite it doesn’t look that great on me. It’s  too orangey.,4 Apr 2024,Ok product beautiful packaging,Cindybst,Tilbury,Lip,No
I am not a big fan of plumping lip glosses. But this was not to bad. It was tingly but not burning. Color is super pretty,4 Apr 2024,Pretty,oliviaelle49,Tilbury,Lip,No
I love this lip plumper. It is a very nice neutral color. It has a nice tingle that subtly plumps lips. I love the applicator too. It glides on easily and stays on for hours.,4 Apr 2024,Love,jobyn,Tilbury,Lip,No
"Before I begin this review I am obligated to inform you that this review is ""Incentivized"" I received these products in exchange for my most honest review:

I have reviewed many lip plumpers! In most cases there is a spicy, burning sensation that ranges in intensity; some hurting more then others and most are a sticky formula. 

This is not what I encountered with the pillow talk big lip plumpgasm. In fact I’m not sure I will ever use another brand again! The formula is buttery and not greasy or sticky or overly thick. 

Rather than the uncomfortable burning sensation I was pleasantly surprised to feel a cooling sensation instead! I am a light neutral skin tone and the medium deep was beautiful! My lips are naturally a deeper color and even darker as my skin meets the summer sun.

I experienced no sensations of discomfort, redness, intense scent or fragrance, or an allergic reaction! I do infact love this plumping formula.",4 Apr 2024,Lux,,Tilbury,Lip,No
"Girl, lemme tell you this made my lips plump I’m not lying, I love it and it does have a small tingle nothing major but it’s awesome and it makes me look beautiful!, the scent is very light the color is perfect! I’ll be wearing this all the time!",4 Apr 2024,I love this!!!,RamblinnMa,Tilbury,Lip,No
"Whew! The icy tingle hits right away with this one! The packaging  is absolutely gorgeous, I feel so fancy pulling it out of my purse! The medium/deep color was a darker berry color and a little really goes a long way!",4 Apr 2024,Love it!,ayeefilthy,Tilbury,Lip,No
"I wanted to like this lip plump. But to be honest I didn’t notice any (visible) difference that would justify using this versus a regular lip gloss. I mean, it does look super nice, with a nice subtle color that is shiny without it being too excessive. But I’m not sure if I want to get through the whole tingling refreshing sensation of the plumping effect. Anyway, it does look pretty cool, the color is great, the package is nice, I will probably keep using while I still have it.",4 Apr 2024,,gabizago,Tilbury,Lip,No
